id,name,requirements,tasks,summary,pageUrl
JOB48930743633,Machine Learning Engineer - Product,,"Collect and gather datasets to build machine learning (ML) models that make real-time decisions for the Nextdoor platform,Analyze datasets and and use important features to build low-latency models for decisions that need to be made quickly,Deploy ML models into production environments and integrate them into the product,Run and analyze live user-facing experiments to iterate on model quality by measuring impact on business metrics,Collaborate with other engineers and data scientists to create optimal experiences on the platform,B.S. in Computer Science, Applied Math, Statistics, Computational Biology or a related field,5+ years of industry/academic experience applying machine learning at scale.,Proven engineering skills. Experience writing and maintaining high-quality production code. Python experience a plus.,Ability to work with and analyze large amounts of data.,Experience building ML products at large consumer-facing companies,Experience building ML products related to ads relevance or newsfeed products","#TeamNextdoor
Nextdoor is the neighborhood hub for trusted connections and the exchange of helpful i...",https://www.linkedin.com/jobs/view/machine-learning-engineer-product-at-nextdoor-1967243118?refId=07e8e278-aa1c-4bab-ad96-0b187970e3bf&position=17&pageNum=0&trk=public_jobs_job-result-card_result-card_full-click
JOB154836576800,Applied Machine Learning Engineer,"Deep technical skills in machine learning, deep learning, computer vision, natural language processing, or artificial intelligence,Good track record of innovation in creating novel computer vision and machine learning algorithms and advancing the state of the art,Strong fundamentals in problem solving, algorithm design, and model building, and experiences in building early stage products,A passion for creating innovative techniques, making them robust and scalable, and realizing in high impact products",,We are looking for experienced research scientists with a passion for using machine learning and com...,https://filemakerjobs.apple.com/en-us/details/200047922/applied-machine-learning-engineer
JOB155122608666,Applied Machine Learning Engineer,"Deep technical skills in machine learning, deep learning, computer vision, natural language processing, or artificial intelligence,Good track record of innovation in creating novel computer vision and machine learning algorithms and advancing the state of the art,Strong fundamentals in problem solving, algorithm design, and model building, and experiences in building early stage products,A passion for creating innovative techniques, making them robust and scalable, and realizing in high impact products",,We are looking for experienced research scientists with a passion for using machine learning and com...,https://filemakerjobs.apple.com/en-us/details/200044393/applied-machine-learning-engineer
JOB247596016960,Claims Machine Learning Engineer,"BS degree in Computer Science, Machine Learning or Artificial Intelligence major is preferred or equivalent experience,Minimum of 5 years full time hands-on software engineering experience,Minimum of 2-3 years full time hands-on machine learning or artificial intelligence software engineering experience,Both front and backend technical experience with cognitive business applications.,Instinctive knowledge of how people will want to use a product, service, or solution that solves a real world business problem.,Hands on experience with various supervised and unsupervised machine-learning techniques,Understanding of various deep machine-learning techniques,Hands on experience in one or two of the following areas: machine learning, natural language processing, or ontology engineering technologies.,Ability to develop and adapt standard machine learning methods and best practice","Develops and adapts best practices to design and build medium complexity machine learning systems,Contributes to design and prototyping of medium to high complexity machine learning systems,Contributes to the realization of major machine learning technical capabilities in the industry by being responsible for the identification, research and software implementation of these capabilities,With some technical support, leads a technical team to implement machine learning solutions,Contributes to effort to revise current practices; lead innovation in technical capability delivery,Provides influence and technical advice to Jr. level team members when developing solutions,Reaches out to support and collaborate with other technology functional teams to build the solution,Represents area of professional and/or technical expertise for Claims,May be considered a thought leader within the team","Job description
Where good people build rewarding careers.
Think that working in the insurance field...",https://www.linkedin.com/jobs/view/claims-machine-learning-engineer-at-allstate-830902650/?utm_campaign=google_jobs_apply&utm_source=google_jobs_apply&utm_medium=organic
JOB254698579273,"Results for ""Machine Learning Engineer Jobs in United States""",,,,https://www.linkedin.com/jobs/machine-learning-engineer-jobs
JOB260696615487,Applied Machine Learning Engineer,"Deep technical skills in machine learning, deep learning, computer vision, natural language processing, or artificial intelligence,Good track record of innovation in creating novel computer vision and machine learning algorithms and advancing the state of the art,Strong fundamentals in problem solving, algorithm design, and model building, and experiences in building early stage products,A passion for creating innovative techniques, making them robust and scalable, and realizing in high impact products",,We are looking for experienced research scientists with a passion for using machine learning and com...,https://filemakerjobs.apple.com/en-us/details/200047920/applied-machine-learning-engineer
JOB13789660909,"Machine Learning Engineer - San Jose, CA - Indeed.com",,,,https://www.indeed.com/jobs?q=data%20scientist&l=Mountain%20View%2C%20CA&radius=15&explvl=entry_level&ts=1532407691135&rq=1&fromage=last&vjk=ee005ec2fb15e7f4
JOB24428537947,Senior Machine Learning Engineer,Experience in scientific computing with other languages & frameworks,"Choose your own hardware & setup for your working environment. Adjustable standing desks available.,Workplace pension. We'll match your contributions up to 10%.,Significant software engineering skills and experience,Strong academic record and a degree with high mathematical and computing content e.g. Computer Science, Mathematics, Engineering or Physics from a leading university,Strong Python & Cython,Proficient in C/C++ on modern architectures,Experience with the NumPy/SciPy stack,Strong general high performance computing:
Multi threading
Profiling Python/C/C++ and performance optimisation
Networking,Multi threading,Profiling Python/C/C++ and performance optimisation,Networking,Proficient on Linux platforms with knowledge of various scripting languages,Takes pride in engineering excellence and encourages best practice in others,A systematic, analytical approach to tackling problems and designing solutions,Other relevant qualifications in Computer Science, Engineering, Maths, Physics etc,Experience of machine learning techniques and related libraries and frameworks e.g. scikit-learn, Tensorflow","
Job description
At Longshot Systems we build advanced platforms for sports betting analytics and tr...",http://stackoverflow.com/jobs/155831/senior-machine-learning-engineer-longshot-systems-ltd
JOB25216636669,Hiring Kit: Machine Learning Engineer,,,"
Increasingly, successful modern businesses are relying on digitization and automation to make their...",https://www.techrepublic.com/resource-library/whitepapers/hiring-kit-machine-learning-engineer/
JOB31085856480,Machine Learning Engineer jobs,,"Expertise in applied machine learning.,Strong technical knowledge of classical machine learning approaches as well as novel Deep Learning methods.,Information retrieval, machine learning, artificial intelligence, statistics and analytics.,Salary offers are based on candidates' education level and years of…,Build machine learning systems to understand the secondary marketplace eCommerce ecosystem.,We are looking for a highly-skilled Machine Learning Engineer with a…,Solid understanding and hands on experience with solving computer vision problems using deep learning.,Develop deep learning models (CNN/RNN) for production…,Experience in machine learning, deep learning, search, natural language processing, data science, or computer vision.,Proficiency with C/C++/Java.,Proficiency with Python and basic libraries for machine learning such as scikit-learn and pandas.,Proficiency with a deep learning framework such as TensorFlow…,As a machine learning engineer, you'll be responsible for the end-to-end process of designing and running experiments to serving production models at scale.,Experience applying machine learning to image/video preferred.,Experience with conventional machine learning techniques and coding packages (e.g. scikit-learn).,Experience with 5+ years’ experience as a machine learning engineer;,Experience in at least one of the following areas: machine learning, and data mining;,You can apply advanced statistical and machine learning techniques to model user behavior, build benchmark metrics, and drive causal impact using A/B testing.,Apply the latest advances in deep learning and machine learning to personalize Pinterest user's Homefeeds.,5+ years experience applying machine learning methods…,Responsible for architecting and building machine learning tools and infrastructure using Python, AWS/K8s, Tensorflow and more.,Designs and prototypes complex machine learning systems.,Hands on experience with various deep machine-learning techniques.,The machine learning workflow has no standard tooling for labeling data, storing it, debugging models and then continually improving model accuracy.,Demonstrated familiarity with and understanding of the latest advances in deep learning.,Hands on experience with open source deep learning toolkits such as:…","
Expertise in applied machine learning.
Strong technical knowledge of classical machine learning app...",https://www.indeed.com/jobs?q=Machine+Learning+Engineer&l=
JOB42610886359,"Machine Learning Engineer - Fraud Engineering, Algorithms, and Risk","Strong working knowledge of machine learning algorithms including classifiers, clustering algorithms and anomaly detection techniques.,Familiarity with database modeling and data warehousing principles and SQL.,Familiarity with Big Data tools like Spark, Hive etc.,Strong programming skills in Scala, Java, Python, or similar language,Excellent social, written, and verbal communication skills,Ability and solace working independently and making key decisions on projects",," Imagine what you could do here. At Apple, new ideas have a way of becoming extraordinary products, ...",https://www.indeed.com/rc/clk?jk=915e2893ca435077&fccid=c1099851e9794854&vjs=3
JOB47141302949,"Which is a better job position, machine learning engineer or software developer?",,,"Go for machine learning engineering
The best part is
You would be in an unconventional trend
And you...",https://www.quora.com/Which-is-a-better-job-position-machine-learning-engineer-or-software-developer
JOB58868955416,"Scientist/Machine Learning Engineer, Applied Science","PhD degree in a closely related field (e.g.: computer science/engineering, optimization) with publications in the area is strongly preferred,Or Masters with significant experience in advertising and Machine Learning,Experience in one or more of the following areas: machine learning, data mining, statistical modeling, optimization, algorithms, big-data, game theory,Proficiency with one or more programming languages - ability to write/debug production code.,Excellent communication skills ability to present and communicate complex ideas in simple terms,Previous experience in the advertising industry,Strong programming experience with Java, C/C++, Python and/or Scala","Research, design and/or implement solutions to challenging problems in real-time bidding domain, such as all kinds of optimization problems, audience understanding, etc.,Research and improve features and machine learning models for production pipeline.,Provide insights and suggestions on customer campaign optimization problems and product/platform optimization problems through statistical data analysis when needed.","About Amobee:
Amobee is a technology company that transforms the way brands and agencies make market...","https://www.glassdoor.com/job-listing/scientist-machine-learning-engineer-applied-science-amobee-JV_IC1147394_KO0,51_KE52,58.htm?jl=2554605968&ctt=1548749004221"
JOB59919959800,Data Science Machine Learning Engineer,,,"Data Science/Machine Learning Engineer or Senior Data Science/Machine Learning Engineer
You will wor...",https://www.indeed.com/rc/clk?jk=55e8dfe8ee9eb722&fccid=16d24b4316c5d97f&vjs=3
JOB70260606715,Machine Learning Engineer,,,"Looking to get in on the ground floor of a startup?
We have an opportunity with exciting tech startu...",https://www.indeed.com/viewjob?jk=558108d20a8e6199&tk=1clkf7ogt1fho53c&from=vjnewtab
JOB71900099251,Which nano degree on Udacity is more job fetching “Machine Learning engineer” or “Data scientist”?,,,,https://www.quora.com/unanswered/Which-nano-degree-on-Udacity-is-more-job-fetching-Machine-Learning-engineer-or-Data-scientist
JOB80025380958,Senior Machine Learning Engineer - Recommendation Systems,"5+ years of Computer Science/ Software Engineering experience,Data structures (stacks, queues, multi-dimensional arrays, trees, graphs, etc.),Algorithms (searching, sorting, optimization, dynamic programming, etc.),Computer architecture (memory, cache, bandwidth, deadlocks, distributed processing, etc.),Understanding of probability and statistics topics, such as conditional probability, Bayes rule, likelihood, independence, etc.,Experience in working with big data and shipping production level machine learning software code,Experience in applying standard implementations of machine learning algorithms (that are widely available e.g. scikit-learn, Theano, Spark MLlib, H2O, etc) effectively by choosing a suitable model (decision tree, nearest neighbor, neural net, ensemble of multiple models, etc.),Understanding of how these different pieces work together, communicate with them (using library calls, REST APIs, database queries, etc.) and build appropriate interfaces for your component that others will depend on.,Understanding of system design may be necessary to avoid bottlenecks and let your algorithms scale well with increasing volumes of data.,Fluent in one or more backend languages, with experience in Ruby a plus, and stay up-to-date on standard methodologies.",,"
Job description
About the Role
As a Machine Learning Software Engineer, you'll help build a recomme...",https://stackoverflow.com/jobs/203447/senior-machine-learning-engineer-recommendation-wework-global-technology
JOB86056044660,Machine Learning Engineer - Data & Analytics,,,Slalom is a purpose-driven consulting firm that helps companies solve business problems and build fo...,https://www.cc.gatech.edu/job-opportunity/15275/machine-learning-engineer-data-analytics
JOB101777232907,Federal - Senior Machine Learning Engineer,"3+ years’ experience in building and evolving complex software systems for data processing and machine learning workloads,Experience with Performance Engineering including testing, tuning and monitoring tools.,Expert knowledge and experience with Python","Understands and translates business and functional needs into machine learning problem statements.,Translates complex machine learning problem statements into specific deliverables and requirements.,Designs and develops scalable solutions that leverage machine learning and deep learning models to meet enterprise requirements.,Works closely with data scientists and data engineers to develop machine learning algorithms,Works on Optimization of Neural Net and Deep Learning models for inference learning algorithms into production-level code.,Collaborates with development teams to test and deploy machine learning models,Creates metrics to continuously evaluate the performance of machine learning solutions.,Maintains and improves the performance of existing machine learning solutions.,Ensures adherence to performance standards and compliance to data security requirements.,Keeps abreast with new tools, algorithms and techniques in machine learning and works to implement them in the organization","
Job Description
Organization: Accenture Federal Services
Location: San Antonio, TX
Accenture Federa...",https://www.accenture.com/us-en/careers/jobdetails?id=00787772_en&title=Federal+-+Senior+Machine+Learning+Engineer
JOB105932949209,Machine Learning Engineer,,,Indeed Prime is a free service that connects qualified job-seekers (that's you) with top companies h...,https://www.indeed.com/pagead/clk?mo=r&ad=-6NYlbfkN0DhVAxkc_TxySVbUOs6bxWYWOfhmDTNcVTjFFBAY1FXZ-rp2wL8MOiZo8poAkpLLNafNJnJtRY-zqDS2AkAWm2y1sBL3UJ9hSlZFqyGGLiK58_X0pQquoHVkbdJ-goBMU8j0avgaMesUHdPNB_osHO37lLTDwLHsgf17HH9YNQe42Dn38fXK29_C0gcpFm6qU8XjwY-KmitmNVHaww6Fl9evo8A1_0Lip662QfjNvyornVimI_aKTyurgQiIFkvtSWue0SzFTmK5eIi7l5FIPkDjD-m5b1mBL2g_R3nBzQvUL5HyJ0ZQwpu_Mua2QFpwX3lnDxvY2_jVZIp3QHZhd_dCcJ1ZlJ7vlIK5E6nL9P_nYlrACmcfTE9HgOFBvJ06DyWwp1Z1fAUiHl822bXHACFccdUubJhXQqI7I0VfUQ3Fb8KCtiFYoNTbyv8CA3ZLmUi3W6VBQAYPHK7IAULCRDi4_vz4AVGb91ilfBv63gQrNIBZofRwjsXVNE_nD9ON0hVoMuwJfFUN9WCMOD1EnLxYalZAyRoamQg0L25OMyo1Zk-wtsagpIm7Zs7qRe4yc8sDhsoBvNLg4c1tiJ2D6BpgpOHF3QsR46kVxI5p_Dh5DBvcCcbVRIe&vjs=3&p=4&sk=&fvj=0
JOB111273519196,Machine Learning Engineer - Recommendation Systems,"5+ years of Computer Science/ Software Engineering experience,Data structures (stacks, queues, multi-dimensional arrays, trees, graphs, etc.),Algorithms (searching, sorting, optimization, dynamic programming, etc.),Computability and Complexity (P vs. NP, NP-complete problems, big-O notation, approximate algorithms, etc.),Computer architecture (memory, cache, bandwidth, deadlocks, distributed processing, etc.),Understanding of probability and statistics topics, such as conditional probability, Bayes rule, likelihood, independence, etc.,Experience in Data Modeling & Evaluation,Experience in working with big data and shipping production level machine learning software code,Experience in applying standard implementations of machine learning algorithms (that are widely available e.g. scikit-learn, Theano, Spark MLlib, H2O, etc) effectively by choosing a suitable model (decision tree, nearest neighbor, neural net, ensemble of multiple models, etc.),Understanding of the relative advantages and disadvantages of different approaches, and the numerous gotchas (bias and variance, overfitting and underfitting, missing data, data leakage, etc.),Understanding of how a small component that fits into a larger ecosystem of products and services.,Understanding of how these different pieces work together, communicate with them (using library calls, REST APIs, database queries, etc.) and build appropriate interfaces for your component that others will depend on.,Understanding of system design may be necessary to avoid bottlenecks and let your algorithms scale well with increasing volumes of data.,Software engineering best practices (including requirements analysis, system design, modularity, version control, testing, documentation, etc.) are invaluable for productivity, collaboration, quality and maintainability.,Fluent in one or more backend languages, with experience in Ruby a plus, and stay up-to-date on standard methodologies.",,"
Job description
As a Machine Learning Software Engineer, you'll help build a recommendation system ...",https://stackoverflow.com/jobs/200785/machine-learning-engineer-recommendation-systems-wework
JOB118488213623,Machine Learning Engineer,"Python,SQL,Relational databases (e.g., Postgres, MySQL),Distributed computation (e.g., Spark, Hive, Athena),Cloud infrastructure (we use AWS),General application (e.g., web API) development,Git collaboration","Competitive base salary,Profit sharing or equity, based on experience,100%-covered Health insurance for employees, 75%-covered dependents,Four weeks PTO,401(k) with employer matching,Personalized monthly perks and matched charitable donations","
Job description
Strong Analytics is seeking a full-time, remote machine learning engineer to collab...",http://stackoverflow.com/jobs/448223/machine-learning-engineer-strong-analytics
JOB144076637929,Machine Learning Engineer,,,"Indeed Prime helps talent secure top offers from leading companies
Indeed Prime is a FREE service th...",https://primejobs.indeed.com/jobs/6a8593c79e1e5d69/machine-learning-engineer-zulily
JOB146720172122,Senior Python and Machine Learning Engineer - Remote - EU Time Zone,"Solid experience as Python Developer,Experience as a Machine Learning Engineer or as a Data Engineer,Experience with Pytorch is a big plus,Experience with OpenCV, Matplotlib, Numpy, SciPy,Understanding of computer science fundamentals, including data structures, algorithms, computability and complexity and computer architecture,Understanding of the functional programming paradigms,Basic understanding of databases, SQL, concurrency, and parallelism,Confident verbal and written English,Able to balance pragmatism with planning and long-term thinking,Proactive and self-sufficient,Attention to detail,Leadership skills,Experience working remotely is a plus,BSc in Computer Science, Engineering or relevant field,Fully distributed team, located in 19 countries,4 weeks paid holiday per year,Yearly team meetup - this year we went to Portugal!,Scrum development process,Anti-discriminatory company culture - we won’t discount you for things like needing to pick your kids up from school, your age, your ethnicity, or your gender,An excited, communicative, and helpful team - we keep our work environment positive, but we also place importance on honesty,Please state in the subject the job position you are applying for,Please mention your city and country of residence in your application,English applications only - a professional speaking and writing command of English is required for this role,Due to time zone difficulties, we’re currently only accepting applicants in European timezones","Take on the challenge to improve the performance of real world autonomous systems and be a crucial part in shaping our clients’ success.,Collaborate with and support the development team,Able to be the main point of contact for enterprise projects,Work on the entire Deep Learning pipeline, including the generation of data, training networks, and optimizing models for deployment,Investigate and develop deep learning architectures for imagery-based perception systems,Collaborate with engineers and other data scientists to evaluate and improve our systems,Able to be the main point of contact for enterprise projects,Implement software enhancements and suggest improvements","
Job description
CVEDIA is a funded AI company that develops deep learning solutions for some of the...",http://stackoverflow.com/jobs/436963/senior-python-and-machine-learning-engineer-cvedia-pte-ltd
